{
  "schema_version": "1.0.0-draft.1",
  "checkpoint_id": "urn:foi-process:checkpoint:sha256:87e22761a529068cf1327761441bbd43a260fd8f03f24f6faf1e566e7ed8db97",
  "consumer": "urn:foi-process:consumer:fixture",
  "created_at": "2026-07-09T00:05:00Z",
  "partitions": [
    {
      "source": "urn:fyi-cli:site:fyi.org.nz",
      "partition": "requests",
      "last_sequence": 5
    }
  ],
  "state_hash": "87e22761a529068cf1327761441bbd43a260fd8f03f24f6faf1e566e7ed8db97",
  "attributes": {}
}
